id,title,company,location,salary,experience_required,job_type,description,required_skills,responsibilities
1,Python Developer,TechCorp,New York,"$90,000 - $120,000","3+ years",Full-time,"We are looking for an experienced Python developer to join our team. You will be responsible for developing and maintaining backend services and APIs.","Python, Flask, Django, SQL, REST APIs","Develop backend services; Write clean, maintainable code; Collaborate with frontend team; Optimize application performance"
2,Data Scientist,DataWorks,Remote,"$110,000 - $140,000","5+ years",Full-time,"Join our data science team to build machine learning models and analyze large datasets.","Python, Machine Learning, Data Analysis, SQL, Pandas, NumPy","Build predictive models; Analyze data; Create visualizations; Present findings to stakeholders"
3,Frontend Developer,WebSolutions,San Francisco,"$95,000 - $125,000","2+ years",Full-time,"We need a frontend developer to create beautiful, responsive user interfaces.","JavaScript, React, HTML, CSS","Develop user interfaces; Optimize for performance; Work with designers; Write tests"
4,DevOps Engineer,CloudTech,Austin,"$100,000 - $130,000","4+ years",Full-time,"Looking for a DevOps engineer to manage our cloud infrastructure and CI/CD pipelines.","AWS, Docker, Kubernetes, CI/CD, Linux","Manage cloud infrastructure; Automate deployments; Monitor systems; Improve scalability"
5,Full Stack Developer,DigitalNest,Chicago,"$85,000 - $110,000","3+ years",Full-time,"Join our team as a full stack developer working on both frontend and backend.","JavaScript, Python, React, Node.js, SQL","Develop features end-to-end; Debug issues; Collaborate across teams; Write documentation"